[
  {
    "id": "21212121-2121-4212-8212-212121212121",
    "siteId": "11111111-1111-4111-8111-111111111111",
    "name": "Temperature haute fermentation",
    "scope": "tank",
    "metric": "temperatureC",
    "comparator": "gt",
    "threshold": 18,
    "enabled": true,
    "channels": ["email"],
    "createdAt": "2026-05-18T09:00:00.000Z",
    "updatedAt": "2026-05-18T09:00:00.000Z"
  }
]
